{
  "event_id": "8",
  "en_abbr": "pyladieskh202606",
  "title": "Python 金融數據工作坊 - 資料統計與視覺化",
  "datetimes": [
    {
      "timeslot": 1,
      "datetime_start": "2026-06-27 14:00:00",
      "datetime_end": "2026-06-27 17:00:00"
    }
  ],
  "locations": ["kaohsiung-ait-data-center", "taipei-aic", "online"],
  "speakers": [
    { "timeslot": 1, "speaker": "MarsW" }
  ],
  "register_links": [
    "https://pyladies-kaohsiung.kktix.cc/events/pyladieskh202606", "https://pyladies-kaohsiung.kktix.cc/events/pyladieskh202606-taipei"
  ],
  "recap_links": [
    { "type": "fb", "label": "活動回顧貼文", "url": "https://www.facebook.com/pyladies.kaohsiung/posts/pfbid02phZ4GyfwFSR8ZutqbzkyJA2kBfZp3KMfXQz8aw4sUc7c2FvcvdR4wxjZP9AG7Q85l"},
    { "type": "slides", "label": "工作坊講義" , "url": "https://python-practical-workshop.github.io/statistics_vis/"}
  ],
  "topic_id": "data-workshop",
  "target_audiences": ["初學者"]
}
