{
  "event_id": "5",
  "en_abbr": "pyladieskh202603",
  "title": "Python 金融數據工作坊 - 網路爬蟲",
  "datetimes": [
    {
      "timeslot": 1,
      "datetime_start": "2026-03-21 14:00:00",
      "datetime_end": "2026-03-21 17:00:00"
    }
  ],
  "locations": ["kaohsiung-ait-data-center", "online"],
  "speakers": [
    { "timeslot": 1, "speaker": "MarsW" }
  ],
  "register_links": [
    "https://pyladies-kaohsiung.kktix.cc/events/pyladieskh202603"
  ],
  "recap_links": [
    { "type": "fb", "label": "活動回顧貼文", "url": "https://www.facebook.com/pyladies.kaohsiung/posts/pfbid0r7RETtX37sjSUXjbJbtGRfFrag8iUMgMeAy4bZxvuuwULYzUi4q2CbuJGTD6Sv25l"},
    { "type": "slides", "label": "工作坊講義" , "url": "https://python-practical-workshop.github.io/crawler/"}
  ],
  "topic_id": "data-workshop",
  "target_audiences": ["初學者"]
}
