{
  "event_id": "9",
  "en_abbr": "pyladieskh202607",
  "title": "Python 金融數據工作坊 - 機器學習",
  "datetimes": [
    {
      "timeslot": 1,
      "datetime_start": "2026-07-25 14:00:00",
      "datetime_end": "2026-07-25 17:00:00"
    }
  ],
  "locations": ["kaohsiung-ait-data-center", "taipei-aic", "online"],
  "speakers": [
    { "timeslot": 1, "speaker": "MarsW" }
  ],
  "register_links": [
    "https://pyladies-kaohsiung.kktix.cc/events/pyladieskh202607", "https://pyladies-kaohsiung.kktix.cc/events/pyladieskh202607-taipei"
  ],
  "recap_links": [
    { "type": "fb", "label": "活動回顧貼文", "url": "https://www.facebook.com/pyladies.kaohsiung/posts/pfbid01F2HYAEQ41RUnaq6LXAtZ5JJZvRBfkxTWLkuhZ9x7EfZnvbYEd9S2iGAsf1Cn5fsl"},
    { "type": "slides", "label": "工作坊講義" , "url": "https://python-practical-workshop.github.io/machine_learning/"}
  ],
  "topic_id": "data-workshop",
  "target_audiences": ["初學者"]
}
